{
    "$schema": "./configSchema.json",
    "unityBuildDir": "Unity/KSPBurst/Build",
    "kspMin": "1.12.3",
    "kspMax": "1.12",
    "version": "1.7.4.2",
    "versionTemplate": "tools/KSPBurst.version.in",
    "unityPackages": [
        "Unity.Burst",
        "Unity.Mathematics",
        "Unity.Collections",
        "Unity.Jobs"
    ],
    "unityDependencies": [
        {
            "name": "System.Runtime.CompilerServices.Unsafe.dll",
            "additionalSearchPaths": [
                "Unity/KSPBurst/Library/PackageCache/*burst*"
            ]
        },
        "System.Runtime.dll"
    ],
    "invalidFileVersion": [
        "Unity.Burst.Unsafe.dll",
        "System.Runtime.CompilerServices.Unsafe.dll"
    ]
}
